{
  "schema_version": 1,
  "config_id": "cfg_01xconnect",
  "network_id": "net_private",
  "device_id": "dev_laptop",
  "generation": 42,
  "issued_at": "2026-08-27T12:00:00Z",
  "expires_at": "2026-08-28T12:00:00Z",
  "proxy_core": "xray",
  "transport": {
    "kind": "vless-tls-xudp",
    "loopback": {"host": "127.0.0.1", "port": 51830},
    "remote": {
      "host": "gateway.example.net",
      "port": 443,
      "server_name": "gateway.example.net"
    },
    "auth_id": "auth_device_01"
  },
  "wireguard": {
    "interface_name": "wg-xco",
    "addresses": ["10.77.0.10/32"],
    "mtu": 1280,
    "peers": [
      {
        "gateway_id": "gw_tokyo_01",
        "public_key": "AAAAAAAAAAAAAAAAAAAAAAAAAAAAAAAAAAAAAAAAAAA=",
        "allowed_ips": ["10.77.0.0/16"],
        "endpoint": {"host": "127.0.0.1", "port": 51830},
        "persistent_keepalive_seconds": 25
      }
    ]
  },
  "signature": {
    "algorithm": "Ed25519",
    "key_id": "signing_key_01",
    "value": "AAAAAAAAAAAAAAAAAAAAAAAAAAAAAAAAAAAAAAAAAAAAAAAAAAAAAAAAAAAAAAAAAAAAAAAAAAAAAAAAAAAAAA=="
  }
}
